Patient ID,Age,Sex,Indicated for,Prescribing Medication,Concmittant medications,Medical History,Common Side effects,Rare Side effects,Adverse event
P001,65,M,diabetes,Tradjenta (Linagliptin),,Pancreatitis,"Dizziness, Anxiety, nausea, vomiting, runny or stuffy nose, sore throat, cough, diarrhea, dizziness, depression, tiredness/ weakness, seizures, nightmares, headache, slurred speech, fast heartbeat, hypertriglyceridemia, hyperlipidemia, increased uric acid, Rash, angioedema, urticaria, Bullous pemphigoid, nasopharyngitis,  Urinary tract infection"," pain in your joints, severe autoimmune reaction--itching, blisters, breakdown of the outer layer of skin, symptoms of heart failure--shortness of breath (even while lying down), swelling in your legs or feet, rapid weight gain, severe life-threatening pancreatitis (inflammation of your pancreas)",0
P002,72,F,hypertension,Metformin,"Alcohol,  halobetasol topical","Renal insufficiency, Alocholism","Diarrhea, nausea, vomiting, abdominal bloating, abdominal cramping or pain, flatulence, anorexia,  loss of appetite - expereinced on initiation of therapy and resolve spontaneously, Asthenia, chills, flu syndrome, accidental injury, Chest discomfort, flushing, palpitation, Rash, nail disorder, increased sweating, Infection, myalgia, lightheadedness, taste disturbances, headache, rhinitis ","Lactic Acidosis, hypoxemia, sepsis, dehydration, Subnormal B12 levels, Liver function test abnormalities, hepatitis, reduction of TSH levels ",1
P003,58,M,"diabetes, hypertension",Empagliflozin,,Impaired renal function,"Bladder pain, bloody or cloudy urine, change in the color, amount, or odor of vaginal discharge, difficult, burning, or painful urination, frequent urge to urinate, itching, stinging, or redness of the vaginal area, lower back or side pain, pain during sexual intercourse, Discharge with a strong odor from the penis, increased volume of pale, dilute urine, redness, itching, swelling, or pain around the penis, waking to urinate at night, Body aches or pain, cough, loss of voice, muscle pain or stiffness, runny or stuffy nose, sneezing,  , blurred vision, chills, cold sweats, confusion, decreased urination, dizziness, faintness, or lightheadedness when getting up suddenly from a lying or sitting position, fast heartbeat, headache, increased hunger, nausea, nightmares, rapid breathing, seizures, shakiness, slurred speech, sweating, unusual tiredness or weakness, volume depletion (especially in heart failure patients), urinary tract infections, and female genital mycotic infections., Pediatric - hypoglycemia irrespective of concomitant Insulin use, volume depletion (up to 11.4%), including blood pressure (ambulatory) decreased, blood pressure systolic decreased, dehydration, hypotension, hypovolemia, orthostatic hypotension, and syncope, Hypotension, Pruritus, Urticaria, rash, nausea, constipation, , Urosepsis, pyelonephritis, Fournier's gangrene, Increased hematocrit, Angioedema, hypersensitivity reactions, Hypoglycemia with the highest rates occurring in combination with multi-dose insulin with or without metformin (up to 41.3%), Increased low-density lipoprotein cholesterol, dyslipidemia, Diabetic ketoacidosis, ketoacidosis, Arthralgia, Thirst,","Acute kidney injury, urosepsis, pyelonephritis , Upper respiratory infection, salt and water loss, Tubulo-interstitial nephritis, Increased urination, polyuria, pollakiuria, nocturia, Anxiety",0
P004,50,M,none,Tirzepatide,,"Personal or family history of medullary thyroid carcinoma, multiple endocrine neoplasia syndrome type 2, acute kidney injury, worsenig of chronic renal failure, Pancreatitis, Retinopathy, Severe GI disease, Patients with elevated serum calcitonin or thyroid nodules noted on physical examination or neck imaging","nausea, diarrhea, decreased appetite, vomiting, constipation, dyspepsia, and abdominal pain, Hypersensitivity reactions (e.g., urticaria, eczema) sinus tachycardia, increased pancreativ amylase, and serum lipase levels, constipation, dyspepsia, abdominal pain, eructation, flatulence, gastroesophageal reflux disease, abdominal distension, Anti-drug antibodies (up to 51%), neutralizing antibodies, Injection site reactions"," Cholelithiasis, acute pancreatitis, increased serum pancreatic amylase levels, increased serum lipase levels, acute gallbladder disease (including cholelithiasis, biliary colic and cholecystectomy), Acute gallbladder disease (cholelithiasis, biliary colic, cholecystectomy), Blood calcitonin increased, Hypoglycemia (up to 19%), decreased appetite (up to 11%), hyperglycemia, Fatigue, including asthenia, malaise, lethargy, Nasopharyngitis (10.5%), Acute kidney injury, worsening of chronic renal failure",1
P005,60,F,hypertension,Ozempic (semaglutide),,"multiple endocrine neoplasia type 2 (tumors in your glands), Personal or family history of medullary thyroid carcinoma, a stomach or intestinal disorder, pancreatitis, Diabetic retinopathy, kidney disease or, eye problems caused by diabetes (retinopathy), Suicidal behaviour and ideation, Vomiting, Diarrhea, Dehydration, Renal Dysfunction","Low blood sugar (in people with type 2 diabetes), upset stomach, heartburn, burping, gas, bloating, nausea, vomiting, stomach pain, loss of appetite, diarrhea, constipation, runny nose or sore throat, stomach flu symptoms or, headache, dizziness, tiredness","Ozempic use and ileus (stomach paralysis) - bloating, stomach cramps or pain, nausea or vomiting, constipation or diarrhea, or loss of appetite, Hypersensitivity, , vision changes, unusual mood changes, thoughts about hurting yourself, pounding heartbeats or fluttering in your chest, a light-headed feeling, like you might pass out, signs of a thyroid tumor--swelling or a lump in your neck, trouble swallowing, a hoarse voice, feeling short of breath, symptoms of pancreatitis--severe pain in your upper stomach spreading to your back, nausea with or without vomiting, fast heart rate, gallbladder problems--upper stomach pain, fever, clay-colored stools, jaundice (yellowing of the skin or eyes), low blood sugar--headache, hunger, weakness, sweating, confusion, irritability, dizziness, fast heart rate, or feeling jittery, kidney problems--swelling, urinating less, blood in urine, feeling tired or short of breath, stomach flu symptoms--stomach cramps, vomiting, loss of appetite, diarrhea (may be watery or bloody), symptoms of ileus (stomach paralysis)--bloating, stomach cramps or pain, nausea or vomiting, constipation or diarrhea, loss of appetite",1
